id,deskripsi_pengguna,label_rekomendasi,preprocessed
184,Laptop digunakan untuk mengerjakan proyek software engineering dan testing aplikasi.,programming,laptop proyek software engineering testing aplikasi
185,Saya mencari laptop yang mendukung virtual machine untuk belajar cloud computing dan DevOps.,programming,mencari laptop mendukung virtual machine belajar cloud computing devops
186,Butuh laptop untuk menjalankan lingkungan pengembangan seperti Jupyter Notebook dan TensorFlow.,programming,butuh laptop menjalankan lingkungan pengembangan jupyter notebook tensorflow
187,Saya memerlukan laptop untuk membuat dan menjalankan program simulasi sederhana menggunakan bahasa pemrograman.,programming,laptop menjalankan program simulasi sederhana bahasa pemrograman
188,Saya membutuhkan laptop dengan performa tinggi untuk menjalankan software desain 3D seperti AutoCAD dan SolidWorks.,workstation,membutuhkan laptop performa menjalankan software desain 3d autocad solidworks
189,Laptop digunakan untuk melakukan simulasi teknik yang membutuhkan prosesor dan RAM besar.,workstation,laptop simulasi teknik membutuhkan prosesor ram
190,Saya mencari laptop yang mampu menjalankan aplikasi pemodelan dan rendering 3D tanpa lag.,workstation,mencari laptop menjalankan aplikasi pemodelan rendering 3d lag
191,Butuh laptop workstation untuk melakukan analisis data besar menggunakan MATLAB dan Python.,workstation,butuh laptop workstation analisis data matlab python
192,Saya memerlukan laptop yang kuat untuk menjalankan software desain arsitektur seperti Revit dan SketchUp.,workstation,laptop kuat menjalankan software desain arsitektur revit sketchup
193,Laptop digunakan untuk pekerjaan profesional yang membutuhkan GPU kuat seperti rendering video 4K dan simulasi.,workstation,laptop pekerjaan profesional membutuhkan gpu kuat rendering video 4k simulasi
194,Saya ingin laptop dengan spesifikasi tinggi untuk menjalankan beberapa software desain secara bersamaan.,workstation,laptop spesifikasi menjalankan software desain bersamaan
195,"Butuh laptop yang dapat menangani multitasking berat seperti desain grafis, simulasi, dan virtualisasi.",workstation,butuh laptop menangani multitasking berat desain grafis simulasi virtualisasi
196,Saya membutuhkan laptop untuk membuat model 3D dan melakukan rendering animasi kompleks.,workstation,membutuhkan laptop model 3d rendering animasi kompleks
197,Laptop digunakan untuk pekerjaan CAD/CAM yang membutuhkan akurasi dan performa tinggi.,workstation,laptop pekerjaan cadcam membutuhkan akurasi performa
198,Saya mencari laptop workstation untuk mendukung pekerjaan desain mesin dan arsitektur.,workstation,mencari laptop workstation mendukung pekerjaan desain mesin arsitektur
199,Butuh laptop yang kuat untuk komputasi ilmiah dan perhitungan numerik intensif.,workstation,butuh laptop kuat komputasi ilmiah perhitungan numerik intensif
200,"Saya memerlukan laptop untuk menjalankan software analisis data besar seperti SPSS, R, dan Tableau.",workstation,laptop menjalankan software analisis data spss r tableau
201,Laptop digunakan untuk pekerjaan desain produk dan simulasi mekanika fluida.,workstation,laptop pekerjaan desain produk simulasi mekanika fluida
202,Saya membutuhkan laptop workstation dengan kartu grafis profesional seperti NVIDIA Quadro.,workstation,membutuhkan laptop workstation kartu grafis profesional nvidia quadro
203,Butuh laptop yang dapat menjalankan rendering 3D dan editing CAD tanpa mengalami penurunan performa.,workstation,butuh laptop menjalankan rendering 3d editing cad mengalami penurunan performa
204,Saya mencari laptop untuk pekerjaan teknik sipil dan analisis struktur menggunakan software khusus.,workstation,mencari laptop pekerjaan teknik sipil analisis struktur software khusus
205,Laptop digunakan untuk pemrosesan visualisasi data kompleks dan pembuatan model simulasi.,workstation,laptop pemrosesan visualisasi data kompleks pembuatan model simulasi
206,Saya membutuhkan laptop dengan kapasitas penyimpanan besar untuk menyimpan file desain berukuran besar.,workstation,membutuhkan laptop kapasitas penyimpanan menyimpan file desain berukuran
207,"Butuh laptop yang stabil untuk komputasi berat di bidang teknik, arsitektur, dan analisis ilmiah.",workstation,butuh laptop stabil komputasi berat bidang teknik arsitektur analisis ilmiah
